{
  "schemaVersion": "0.1.0",
  "projectId": "anyplan",
  "generatedAt": "2026-06-01T10:03:17+00:00",
  "entryCount": 13,
  "entries": [
    {
      "id": "docs-adr-readme",
      "path": "docs/adr/README.md",
      "title": "Architecture Decision Records",
      "category": "decision",
      "contentType": "markdown",
      "summary": "This directory contains durable project decisions.",
      "inclusionReason": "path:docs/adr/",
      "sections": [
        {
          "level": 1,
          "title": "Architecture Decision Records",
          "line": 1
        },
        {
          "level": 2,
          "title": "Records",
          "line": 7
        }
      ],
      "linkedFrom": []
    },
    {
      "id": "document-generation-spec",
      "path": "framework/spec/document-generation.md",
      "title": "Document Generation Specification",
      "category": "roadmap",
      "contentType": "markdown",
      "summary": "This specification defines how concrete projects produce documents and data files that the Anyplan visual engine can read structurally. It complements guidance-document.md (collaboration rules) and anyplan-guidance.schema.json (guidance ...",
      "inclusionReason": "frontmatter:anyplan.index",
      "sections": [
        {
          "level": 1,
          "title": "Document Generation Specification",
          "line": 1
        },
        {
          "level": 2,
          "title": "1. Required and Recommended Files",
          "line": 7
        },
        {
          "level": 2,
          "title": "2. Dashboard JSON Contract",
          "line": 19
        },
        {
          "level": 3,
          "title": "2.1 Top-Level Sections (Engine Menu)",
          "line": 29
        },
        {
          "level": 3,
          "title": "2.2 Overview",
          "line": 40
        },
        {
          "level": 3,
          "title": "2.3 Roadmap",
          "line": 55
        },
        {
          "level": 3,
          "title": "2.4 Completed Tasks",
          "line": 83
        },
        {
          "level": 3,
          "title": "2.5 Current Phase",
          "line": 100
        },
        {
          "level": 2,
          "title": "3. Linking Dashboard to Guidance",
          "line": 125
        },
        {
          "level": 2,
          "title": "4. Prose Document Conventions",
          "line": 148
        },
        {
          "level": 3,
          "title": "4.1 ProjectState.md",
          "line": 150
        },
        {
          "level": 3,
          "title": "4.2 Roadmap Markdown (Optional)",
          "line": 161
        }
      ],
      "linkedFrom": [
        "dashboard.completed:task-dashboard-engine",
        "guidance:document-generation-spec"
      ],
      "memoryType": "rule",
      "documentId": "document-generation-spec"
    },
    {
      "id": "root-readme",
      "path": "README.md",
      "title": "Anyplan",
      "category": "rule",
      "contentType": "markdown",
      "summary": "Anyplan is a guidance framework and visual interaction engine for AI-assisted software development.",
      "inclusionReason": "filename:README.md (repository root); guidance:root-readme",
      "sections": [
        {
          "level": 1,
          "title": "Anyplan",
          "line": 1
        },
        {
          "level": 2,
          "title": "Adopting the Framework in Your Project",
          "line": 11
        },
        {
          "level": 2,
          "title": "Repository Map",
          "line": 15
        },
        {
          "level": 2,
          "title": "Documentation Language",
          "line": 28
        },
        {
          "level": 2,
          "title": "Open The Engine",
          "line": 34
        },
        {
          "level": 2,
          "title": "First Working Contract",
          "line": 50
        },
        {
          "level": 2,
          "title": "Research Notes",
          "line": 62
        }
      ],
      "linkedFrom": [
        "guidance:root-readme"
      ],
      "memoryType": "overview",
      "documentId": "root-readme"
    },
    {
      "id": "adopting-framework",
      "path": "docs/adopting-the-framework.md",
      "title": "Adopting the Anyplan Framework in Your Project",
      "category": "rule",
      "contentType": "markdown",
      "summary": "This guide explains how to take the portable Anyplan collaboration framework from clone to a project guidance instance that AI tools can follow. It covers Git setup, command-line scaffolding, optional scripts, prose documents, validation...",
      "inclusionReason": "dashboard.completed:task-adoption-guide; guidance:adopting-framework",
      "sections": [
        {
          "level": 1,
          "title": "Adopting the Anyplan Framework in Your Project",
          "line": 1
        },
        {
          "level": 2,
          "title": "What You Are Building",
          "line": 7
        },
        {
          "level": 2,
          "title": "Choose an Integration Model",
          "line": 19
        },
        {
          "level": 3,
          "title": "Model A — Submodule (recommended for active teams)",
          "line": 21
        },
        {
          "level": 3,
          "title": "Model B — Sibling clone (quick trial)",
          "line": 33
        },
        {
          "level": 3,
          "title": "Model C — Copy framework files (offline / fork)",
          "line": 49
        },
        {
          "level": 2,
          "title": "Step 1 — Clone Anyplan",
          "line": 53
        },
        {
          "level": 2,
          "title": "Step 2 — Scaffold a Guidance Instance",
          "line": 62
        },
        {
          "level": 2,
          "title": "Step 3 — Validate the Instance",
          "line": 98
        },
        {
          "level": 1,
          "title": "Option A: Node.js (ajv-cli via npx, no global install required)",
          "line": 109
        },
        {
          "level": 1,
          "title": "Option B: Python jsonschema",
          "line": 112
        },
        {
          "level": 2,
          "title": "Step 4 — Enrich Guidance (Manual or AI-Assisted)",
          "line": 116
        }
      ],
      "linkedFrom": [
        "dashboard.completed:task-adoption-guide",
        "guidance:adopting-framework"
      ],
      "memoryType": "methodology",
      "documentId": "adopting-framework"
    },
    {
      "id": "adr-0001",
      "path": "docs/adr/0001-bootstrap-ai-collaboration-framework.md",
      "title": "ADR 0001: Bootstrap AI Collaboration Framework",
      "category": "rule",
      "contentType": "markdown",
      "summary": "Accepted",
      "inclusionReason": "dashboard.completed:task-adr-bootstrap; guidance:adr-0001; path:docs/adr/",
      "sections": [
        {
          "level": 1,
          "title": "ADR 0001: Bootstrap AI Collaboration Framework",
          "line": 1
        },
        {
          "level": 2,
          "title": "Status",
          "line": 3
        },
        {
          "level": 2,
          "title": "Context",
          "line": 7
        },
        {
          "level": 2,
          "title": "Decision",
          "line": 17
        },
        {
          "level": 2,
          "title": "Consequences",
          "line": 26
        }
      ],
      "linkedFrom": [
        "dashboard.completed:task-adr-bootstrap",
        "guidance:adr-0001"
      ],
      "memoryType": "decision",
      "documentId": "adr-0001"
    },
    {
      "id": "adr-0002",
      "path": "docs/adr/0002-english-docs-and-research-extraction.md",
      "title": "ADR 0002: English Documentation and Research Extraction Boundary",
      "category": "rule",
      "contentType": "markdown",
      "summary": "Accepted",
      "inclusionReason": "dashboard.completed:task-english-research; guidance:adr-0002; path:docs/adr/",
      "sections": [
        {
          "level": 1,
          "title": "ADR 0002: English Documentation and Research Extraction Boundary",
          "line": 1
        },
        {
          "level": 2,
          "title": "Status",
          "line": 3
        },
        {
          "level": 2,
          "title": "Context",
          "line": 7
        },
        {
          "level": 2,
          "title": "Decision",
          "line": 16
        },
        {
          "level": 2,
          "title": "Consequences",
          "line": 36
        }
      ],
      "linkedFrom": [
        "dashboard.completed:task-english-research",
        "guidance:adr-0002"
      ],
      "memoryType": "decision",
      "documentId": "adr-0002"
    },
    {
      "id": "adr-0003",
      "path": "docs/adr/0003-bounded-context-retrieval.md",
      "title": "ADR 0003: Bounded Context Retrieval",
      "category": "rule",
      "contentType": "markdown",
      "summary": "Accepted",
      "inclusionReason": "dashboard.completed:task-bounded-retrieval; guidance:adr-0003; path:docs/adr/",
      "sections": [
        {
          "level": 1,
          "title": "ADR 0003: Bounded Context Retrieval",
          "line": 1
        },
        {
          "level": 2,
          "title": "Status",
          "line": 3
        },
        {
          "level": 2,
          "title": "Context",
          "line": 7
        },
        {
          "level": 2,
          "title": "Decision",
          "line": 13
        },
        {
          "level": 2,
          "title": "Consequences",
          "line": 28
        }
      ],
      "linkedFrom": [
        "dashboard.completed:task-bounded-retrieval",
        "guidance:adr-0003"
      ],
      "memoryType": "decision",
      "documentId": "adr-0003"
    },
    {
      "id": "collaboration-log",
      "path": "docs/ai-collaboration-log.md",
      "title": "AI Collaboration Log",
      "category": "rule",
      "contentType": "markdown",
      "summary": "This document records how Anyplan uses its own AI collaboration framework while developing the framework.",